JADIMEXSOMME1|Panneau horizontal en noisetier tressé|Panneau tressé horizontal à utiliser comme clôture de jardin, clôture de pré, treillis, revêtement de mur, ... Pour la fixation de ce panneau, il est conseillé d'utiliser des poteaux en châtaignier, en bois imprégné ou en bois dur.|Cadres RenameClassement2 44|1|../img/import/jadimex/somme.jpg|NON
PANNEAUOSIERGROS120|Panneau en osier gros brins|Diamètre des brins d'osier : 1 à 2 cm<br><br>épaisseur des panneaux : 8 cm<br><br>resistance : +- 10 ans|Cadres RenameClassement2 44|1|../img/import/desindo/osiergros.jpg|NON
PANNEAUOSIERFIN180|Panneau en osier fins brins|Diamètre des brins d'osier : +- 0.5 cm<br><br>épaisseur des panneaux : 4 cm<br><br>resistance : +- 10 ans|Cadres RenameClassement2 44|1|../img/import/desindo/osierfin.jpg|NON
NATTEERICAME100X500X|Natte de bruyère medium (1,5/2 cm), rouleau de +-5 m|Natte de première qualité liée avec des fils en inox. Dune épaisseur de 2 cm, elle possède une très bonne tenue dans le temps.|Produits d'occultation RenameClassement2 30|1|../img/import/desindo/erica.jpg|NON
NATTEESPAGNOLE150X30|Natte de bruyère espagnole (3/4 cm), rouleau de 3 m|Natte de bruyère extra dense liée avec des fils en inox. Dune épaisseur de 3 à 4 cm, elle possède une très bonne tenue dans le temps et une bonne occultation.|Produits d'occultation RenameClassement2 30|1||NON
TOILEBRISEVUE1.5X25|Toile brise-vue verte, 99 %, rouleau de 25 m|Toile verte. Opaque.  Protège du vent, de la vue, de la poussière, du sable.  Tissu épais avec ourlet de renforcement et boutonnières pour faciliter la mise en place.  Convient pour clôtures. Autres hauteurs disponibles.|Produits d'occultation RenameClassement2 30|1|../img/import/divers/brise-vue.jpg|NON
TOILEBRISEVENT2X50|Toile brise-vent verte, 70 %, rouleau de 50 m|Une fois bien tendue, cette toile tient jusqu'à 15 ans. Elle peut être utilisée pour éviter la déshydratation du sol avec le vent, limiter les dégats dûs au gel, limiter la dispersion de semences sauvages. Elle convient également pour une application horizontale comme toile d'ombrage durable.|Produits d'occultation RenameClassement2 30|1||NON
COLORADO100M|Colorado woodlook strip|Le colorado peut être tissé selon votre fantaisie dans les mailles du grillage.  Couper la lamelle à la longueur souhaitée puis fixez la en perforant un trou de +- 3mm et attachez la avec un colson.  <br><br>Cette lamelle d'occultation, souple et universelle se laisse aisément tresser à travers 95% des treillis existants.<br><br>Ces lamelles colorées sont pourvues d'un motif bois.<br><br>Couleurs possibles : noir, gris pastel, anthracite, brun, vert pastel, vert foncé à préciser à la commande.<br><br>http://www.gmp.be/fr/lamelles-de-jardins-haies-artificielles/colorado<br><br>Vidéo de montage : http://www.youtube.com/watch?v=H93VP6z0_So|Produits d'occultation RenameClassement2 30|1|../img/import/gmp/colorado.jpg|OUI
NEVADASUPER153KIT1|Nevada super|Profils en PVC à placer dans les panneaux type Bekafor classic pour occulter.<br><br>Couleurs possibles : bois foncé, bois clair, vert, anthracite.<br><br>Différentes hauteurs possibles : 103,123,153,173,193,203 et 243 cm.<br><br>Il existe un profil de finition en option pour un résultat parfait.<br><br><br><br>http://www.gmp.be/fr/lamelles-de-jardins-haies-artificielles<br>evada-super<br><br>Vidéo de montage : http://www.youtube.com/watch?v=HgR19gR4EGo|Produits d'occultation RenameClassement2 30|1|../img/import/gmp/nevada.jpg;../img/import/gmp/nevada-anthracite.jpg;../img/import/gmp/nevada-bois-clair.jpg|OUI
LOUISIANA152|Louisiana|Lamelles en PVC à placer dans les grillages type pantanet pour occulter. Les lamelles sont pourvues d'un trou à attacher en haut avec un colson par exemple.<br><br>Couleurs possibles : bois foncé, bois clair, vert, noir.<br><br>Différentes hauteurs possibles : 102,122,152,183 et 203 cm.<br><br>Il existe un profil de finition en option pour un résultat parfait.<br><br><br><br>http://www.gmp.be/fr/lamelles-de-jardins-haies-artificielles/louisiana<br><br>Vidéo de montage : http://www.youtube.com/watch?v=kQGXYphPZNg|Produits d'occultation RenameClassement2 30|1|../img/import/gmp/louisiana_noir.jpg;../img/import/gmp/louisiana.jpg|OUI
FLORIDA100|Florida|Lamelles en PVC à placer dans les grillages type plasitor pour occulter. Les lamelles sont pourvues d'un trou à attacher en haut avec un colson par exemple.<br><br>Couleurs possibles : bois foncé, bois clair, vert, noir.<br><br>Différentes hauteurs possibles : 102,122,152,183 et 203 cm.<br><br>Il existe un profil de finition en option pour un résultat parfait.<br><br>Il faut utiliser un profil en U de base.<br><br>http://www.gmp.be/fr/lamelles-de-jardins-haies-artificielles/florida<br><br>Vidéo de montage : http://www.youtube.com/watch?v=xpvx2k-BuoE|Produits d'occultation RenameClassement2 30|1|../img/import/gmp/florida.jpg|OUI
LIENSGMP|Profil de finition pour lamelles PVC et liens|Profil de finition à utiliser avec le système colorado, florida, nevada super, louisiana.<br><br>Existe en 2m ou 2,5 m de large.<br><br>Liens type colson 10 cm de longueur, divers coloris.|Produits d'occultation RenameClassement2 30|1|;../img/import/gmp/profils-de-finition.jpg|OUI
CANADAGREEN150|Canada green|Haie artificielle verte résistante aux UV, sans entretien.  Pose rapide et facile. Aspect naturel.<br><br>Le canada est un tapis d'épines fines vert foncé.  Disponible en 100,120,150,180 et 200 cm de haut sur rouleaux de 3m.<br><br>Le canada super est un tapis de 2 couleurs d'épines un peu plus large.<br><br>Le canada flex est un brin flexible de 2 couleurs d'épines un peu plus large. <br><br>Vidéo de montage : http://www.youtube.com/watch?v=CE7yWLf-uY8|Produits d'occultation RenameClassement2 30|1|../img/import/gmp/haie-articifielle-canada.jpg|OUI
BETACOLLFORT173|Bekafor Collfort - Betafence|Set de lattes en Pin Nordic Blanc pour panneaux bekafor classic. 1 st = remplissage pour 1 panneau Bekafor classic de 2 m de large : 40 lattes verticales + 3 lattes supplémentaires + 3 lattes horizontales (173 cm) ou 4 lattes horizontales (203 cm).|Produits d'occultation RenameClassement2 30|1|../img/import/beta/bekafor-collfort.jpg;../img/import/beta/Bekafor-Collfort.jpg|OUI
BACLILI50X100|Bac à fleurs en pin traité|Bac à fleurs en pin traîté avec rebord et toile de protection.|Bacs à fleurs et murs végétaux RenameClassement2 22|1|../img/import/desindo/desindo_fleurs.jpg|NON
JADIMEXJARDINIERE1|Jardinière en noisetier tressé|Ces jardinières sont réalisées en noisetier tressé.  ELles peuvent être utilisées comme caches pots à l'intérieur ou à l'extérieur.|Bacs à fleurs et murs végétaux RenameClassement2 22|1|../img/import/jadimex/bacfleur.jpg|NON
PLANTEXPLANTBAG40|PlantBag Plantex - pour bulbes et plantes aquatiques|La poche de plantation PlantBag est la solution innovante pour planter et transplanter.  Grâce à sa solidité, sa souplesse et sa perméabilité à l'eau et à l'air, il offre de nombreux avantages : elle simplifie considérablement la manipulation des plantes, elle protège les plantes de l'envahissement des mauvaises herbes et des animaux nuisibles et est idéale pour les plantes aquatiques. <br> <br><a target='frmPDF' href='/documents/plant_bag.pdf'>Description détaillée (format pdf)</a>|Bacs à fleurs et murs végétaux RenameClassement2 22|1|../img/import/plantex/plantex_bag.jpg|NON
PLANTEXJARDVERT40CM|Jardin vertical Plantex - décoration intérieure et extérieure|Le jardin vertical est idéal pour décorer vos intérieurs comme vos extérieurs; facile à utiliser, il permet de fleurir vos murs, cloisons et terrasses selon vos envies, même pour cultiver des plantes culinaires.<br>Le jardin vertical est fourni avec des fixations et existe en deux modèles : un modèle avec une pochette et un autre avec trois pochettes que vous pouvez moduler à votre guise.|Bacs à fleurs et murs végétaux RenameClassement2 22|1|../img/import/plantex/vertical.jpg|NON
MURVEGMODULE9|Mur végétal|Le kit est composé d'un linteau pour fixation murale, d'un réceptacle à 2 godets en polypropylène blanc-gris et de visserie. <br><br><br><br>Le linteau mural de 2 x 9 cm est en acier galvanisé.<br><br>Le réceptacle fait 20 cm de large sur 12,5 cm de haut (0,025 m²) et est équipé d'une réserve d'eau de 0,3 L avec un dispositif de trop plein. <br><br>Les 2 godets font 9 cm de diamètre permettant le rempotage direct de plante issu de même diamètre. <br><br><br><br>Usage intérieur et extérieur <br><br><br><br>Module pour mur végétal à godets en polypropylène (PP) de couleur gris-blanc.<br><br>Le kit est composé d'un linteau pour fixation murale, d'un réceptacle à réserve d'eau et de 2 godets de plantation diamètre 9 cm + visserie.<br><br>Dimension hors tout : 20 cm de large sur 12,5 cm de haut (0,025 m²)<br><br><br><br>Le linteau fourni est en acier galvanisé et sert de fixation murale pour les réceptacles. Dimension totale de 9 cm sur 2 cm.<br><br>Le réceptacle et les godets sont en polypropylène et peuvent donc s'utiliser en intérieur et extérieur. Le volume de la réserve d'eau : 0,3 L.<br><br>Vous pouvez directement empoter des plantes issus de pots de 9. <br><br>Idéal pour les aromatiques dans une cuisine ou pour créer un mur végétal intérieur ou extérieur.<br><br>Les module peuvent se connecter l'un au dessus|Bacs à fleurs et murs végétaux RenameClassement2 22|1||NON
COLVEGGIE|Table de jardin suspendu||Bacs à fleurs et murs végétaux RenameClassement2 22|1||NON
