PLANTEXRACIBLO0.70X3|RaciBloc Plantex - anti-racines - spécial bambous|Le développement des racines de bambous et des arbres en général peut devenir incontrôlable dans le jardin ou autour de la maison.  Les racines peuvent endommager de manière dévastatrice les surfaces asphaltées et les pavés, les bâtiments et les canalisations.<br>Le RaciBloc offre une solution simple et efficace en contenant la croissance des racines et en assurant ainsi un développement harmonieux et contrôlé de votre jardin. <br> <br><a target='frmPDF' href='/documents/racibloc.pdf'>Description détaillée (format pdf)</a>|Bordures plastique RenameClassement2 24|1|../img/import/plantex/plantex_racine.jpg|NON
BORDUREPIN30/250|Bordure de gazon en pin|Assemblage de 250 cm de rondins traités aux sels, permet toutes les formes.|Bordures bois RenameClassement2 40|1|../img/import/bois/bordure_pin.jpg|NON
BORDUREBOISEXOT20X20|Bordure de gazon en bois exotique|Assemblage de rondins d'une épaisseur de 4,4 cm et d'une hauteur de 20 cm.<br><br>Le fil de lien est galvanisé pour une résistance à toute épreuve. Le bois exotique est plus durable que le pin imprégné.  Elle permet de réaliser toutes sortes de formes de parterres.|Bordures bois RenameClassement2 40|1|../img/import/desindo/bordureboisexo.jpg|NON
JADIMEXBORDER1|Bordure en noisetier tressé|Bordure en noisetier tressé disponibles dans 2 longueurs différentes.  A utiliser avec des piquets en azobé 4 x 4 cm par exemple.|Bordures bois RenameClassement2 40|1|../img/import/jadimex/bordure.jpg|NON
ROOSENSASPENBL|Aspen Stone : murs de soutènement sans mortier|- Aspect pierre naturelle<br><br>- Pas de joints<br><br>- Placement simple et très rapide<br><br>- Système économique<br><br>Idéal pour aménager votre jardin, votre terrasse et vos abords !<br><br>35 pièces/m²   ;  2,9 m²/pal|Bordures pierres, béton RenameClassement2 39|1|../img/import/roosens/aspenstone.jpg|NON
ROOSENSBORD20DRO|Bordure en béton|Les bordures de béton stabilisent les matériaux de chaque côté et donnent un aspect fini et durable à tout aménagement paysager. <br><br>Leur durée de vie est très grande au jardin et elle dépasse souvent celle des occupants des lieux...<br><br>Bordures droites 20 cm : 56 pièces/palette<br>Bordures droites 30 cm : 42 pièces/palette<br>Bordure en rondins : 84 pièces / palette|Bordures pierres, béton RenameClassement2 39|1|../img/import/roosens/bordure_chanfreinee.jpg|NON
BORDUREBLUE100X15X6|Bordure en pierre bleue bluestone|Bordures en pierre bleue asiatique, adoucies des 2 côtés avec une facette de 2X2 mm.|Bordures pierres, béton RenameClassement2 39|1|../img/import/MichelOprey/bordure_bluestone.jpg|NON
CADREELEGANT180X100|Cadre Elegant|La dimension des lattes est de 45 x 45 mm et celle des lamelles est de 9 x 95 mm.  Le pin utilisé a été traité et a une teinte verte.  La visserie est en inox.|Cadres RenameClassement2 44|1|../img/import/desindo/cadre_elegant.jpg|NON
CADRECLASSIC180X180|Cadre Classic FSC|La dimension des lattes est de 45 x 45 mm et celle des lamelles est de 9 x 95 mm.  Le pin utilisé a été traité et a une teinte verte.  La visserie est en inox.|Cadres RenameClassement2 44|1|../img/import/desindo/cadre_elegant.jpg|NON
CADREBELVCINTRE80X18|Cadre Belvédère|Clôture à planches horizontales rabotées.  La dimension des lattes est de 45 x 22 mm et celle des lamelles est de 16 x 115 mm.  Le pin utilisé a été traité et a une teinte verte.  La visserie est en inox. Il y a la possibilité d'avoir une porte assortie au cadre (sur commande).  Garantie de 15 ans.|Cadres RenameClassement2 44|1|../img/import/desindo/belvedere.jpg|NON
CADREDELUXE180X100|Cadre de Luxe|Clôture à planches rabotées.  La dimension des lamelles est de 17 x 140 mm.  Le pin utilisé a été traité et a une teinte verte.  La visserie est en inox. Il y a la possibilité d'avoir une porte assortie au cadre (180X100 cm).|Cadres RenameClassement2 44|1|../img/import/desindo/luxe.jpg|NON
CADREDIAMANT180X180|Cadre Diamant|Clôture à planches de 9 X 95 m.  Le cadre fait 45 X 45 mm.  Le pin utilisé est FSCa été traité et a une teinte verte (garantie de 15 ans).  La visserie est en inox. Il y a la possibilité d'avoir une porte assortie au cadre (sur commande).|Cadres RenameClassement2 44|1||NON
CADRETORINO180X180|Cadre Torino - fin de série|La dimension des lattes est de 45 x 65 mm et celle des lamelles est de 10 x 110 mm.  Le pin utilisé a été traité et a une teinte verte. De plus, il porte le label FSC, il provient de forêt à gestion durable. La visserie est en inox.|Cadres RenameClassement2 44|1|../img/import/desindo/torino.jpg|NON
CADREUNIVDBLE180|Cadre universel double|La dimension des lamelles est de 10 x 100 mm et elles sont agrafées. Le pin utilisé a été traité et a une teinte verte.|Cadres RenameClassement2 44|1||NON
CADREBANKIRAI180X180|Cadre en bangkirai|Cadre haut de gamme. La dimension des lamelles est de 16 x 140 mm.  La visserie est en inox. Existe en modèle cintré. A utiliser avec des poteaux 8,4 mm de section.|Cadres RenameClassement2 44|1|../img/import/desindo/cadre_azobe.jpg|NON
TREILLAGEDIAGO180/18|Treillage diagonal|La dimension des lattes est de 45 x 45 mm et celle des lamelles est de 12 x 30 mm.  Le pin utilisé a été traité et a une teinte verte.  Ce treillage existe en deux dimensions différentes.|Cadres RenameClassement2 44|1|../img/import/desindo/treillagediago.jpg|NON
TREILLAGEROSES180/60|Treillage pour roses|Treillage avec lattes diagonales en sapin traité.|Cadres RenameClassement2 44|1||NON
TREILLAGECARRE180/18|Treillage carré|La dimension des lattes est de 12 x 30 mm.  Le pin utilisé a été traité et a une teinte verte.|Cadres RenameClassement2 44|1|../img/import/desindo/treillagecarre.jpg|NON
JADIMEXGARONNE1|Clôture de jardin en noisetier tressé|Clôture de jardin construite en utilisant des branches épaisses de noisetier qui sont posées verticalement les unes contre les autres.|Cadres RenameClassement2 44|1|../img/import/jadimex/garonne2.jpg|NON
JADIMEXLOIRE1|Panneau vertical en noisetier tressé|Panneau tressé vertical à utiliser comme clôture de jardin, clôture de pré, treillis, revêtement de mur, ... Pour la fixation de ce panneau, il est conseillé d'utiliser des poteaux en châtaignier, en bois imprégné ou en bois dur.|Cadres RenameClassement2 44|1|../img/import/jadimex/loire.jpg|NON
